{
  "$schema": "https://json-schema.org/draft/2020-12/schema",
  "title": "EvidenceRecord",
  "description": "One evidence record: one test function in one run, or one manual review.\n\nThe Rust types are the source of truth; `cargo xtask codegen` publishes\nthe JSON Schema to `schemas/evidence/`. Unknown fields are accepted, so\n`v1` can grow with optional fields.",
  "type": "object",
  "properties": {
    "actual": {
      "description": "What was observed. Required for `PASS` and `FAIL`.",
      "type": [
        "string",
        "null"
      ],
      "default": null
    },
    "context": {
      "description": "The run context; present in `report.json` and manual records, absent\nfrom raw record files.",
      "anyOf": [
        {
          "$ref": "#/$defs/RunContext"
        },
        {
          "type": "null"
        }
      ]
    },
    "covers": {
      "description": "The PRD IDs this test proves.",
      "type": "array",
      "items": {
        "type": "string"
      }
    },
    "evidencePath": {
      "description": "Automated: `output.log` or `artifacts/<id>/`, relative to the run\nfolder. Manual: a path relative to the repository.",
      "type": "string"
    },
    "expected": {
      "description": "The expected behavior in one sentence.",
      "type": "string"
    },
    "finishedAt": {
      "description": "When the final result was written; null while `NOT_RUN`.",
      "type": [
        "string",
        "null"
      ],
      "format": "date-time",
      "default": null
    },
    "id": {
      "description": "A UUID v7, also the name of the raw record file.",
      "type": "string",
      "format": "uuid"
    },
    "kind": {
      "description": "Fixture or native; equal to the kind of the run.",
      "$ref": "#/$defs/Kind"
    },
    "method": {
      "description": "Automated or manual.",
      "$ref": "#/$defs/Method"
    },
    "owner": {
      "description": "Who can unblock a `BLOCKED` record.",
      "type": [
        "string",
        "null"
      ],
      "default": null
    },
    "reason": {
      "description": "Why the record is `BLOCKED` or `DEFERRED`.",
      "type": [
        "string",
        "null"
      ],
      "default": null
    },
    "reviewer": {
      "description": "The reviewer of a manual record.",
      "type": [
        "string",
        "null"
      ],
      "default": null
    },
    "schema": {
      "description": "Always [`RECORD_SCHEMA`].",
      "type": "string"
    },
    "startedAt": {
      "description": "When the guard or trait was created, or the manual record written.",
      "type": "string",
      "format": "date-time"
    },
    "status": {
      "description": "The result.",
      "$ref": "#/$defs/Status"
    },
    "steps": {
      "description": "Manual steps; always null for an automated record.",
      "type": [
        "array",
        "null"
      ],
      "default": null,
      "items": {
        "type": "string"
      }
    },
    "subjects": {
      "description": "The providers or runtimes the test ran against.",
      "type": "array",
      "default": [],
      "items": {
        "$ref": "#/$defs/Subject"
      }
    },
    "test": {
      "description": "Which test this is.",
      "$ref": "#/$defs/TestIdentity"
    }
  },
  "required": [
    "schema",
    "id",
    "covers",
    "kind",
    "method",
    "test",
    "status",
    "expected",
    "startedAt",
    "evidencePath"
  ],
  "$defs": {
    "BaselineMatch": {
      "description": "How a run's host compares with the recorded baseline host.",
      "type": "object",
      "properties": {
        "matches": {
          "description": "True when model, chip, memory, core counts, and `virtualized` are all\npresent and equal.",
          "type": "boolean"
        },
        "osBuildMatches": {
          "description": "True when the macOS build also matches, tracked apart because it\nchanges more often than the hardware.",
          "type": "boolean"
        }
      },
      "required": [
        "matches",
        "osBuildMatches"
      ]
    },
    "Host": {
      "description": "The machine a run or a baseline was recorded on.\n\nHolds no host name and no user name.",
      "type": "object",
      "properties": {
        "arch": {
          "description": "`std::env::consts::ARCH`, for example `aarch64`.",
          "type": "string"
        },
        "chip": {
          "description": "`sysctl -n machdep.cpu.brand_string`, null outside macOS.",
          "type": [
            "string",
            "null"
          ],
          "default": null
        },
        "efficiencyCores": {
          "description": "`sysctl -n hw.perflevel1.physicalcpu`, null when the key is missing.",
          "type": [
            "integer",
            "null"
          ],
          "format": "uint32",
          "default": null,
          "minimum": 0
        },
        "hardwareModel": {
          "description": "`sysctl -n hw.model`, null outside macOS.",
          "type": [
            "string",
            "null"
          ],
          "default": null
        },
        "memoryBytes": {
          "description": "`sysctl -n hw.memsize`, null outside macOS.",
          "type": [
            "integer",
            "null"
          ],
          "format": "uint64",
          "default": null,
          "minimum": 0
        },
        "os": {
          "description": "`std::env::consts::OS`, for example `macos` or `linux`.",
          "type": "string"
        },
        "osBuild": {
          "description": "`sw_vers -buildVersion` on macOS, null elsewhere.",
          "type": [
            "string",
            "null"
          ],
          "default": null
        },
        "osVersion": {
          "description": "`sw_vers -productVersion` on macOS, `uname -r` on Linux.",
          "type": [
            "string",
            "null"
          ],
          "default": null
        },
        "performanceCores": {
          "description": "`sysctl -n hw.perflevel0.physicalcpu`, null when the key is missing.",
          "type": [
            "integer",
            "null"
          ],
          "format": "uint32",
          "default": null,
          "minimum": 0
        },
        "virtualized": {
          "description": "True when `sysctl -n kern.hv_vmm_present` is 1, null outside macOS.",
          "type": [
            "boolean",
            "null"
          ],
          "default": null
        }
      },
      "required": [
        "os",
        "arch"
      ]
    },
    "Kind": {
      "description": "Whether a test needs only fakes and fixtures, or a real provider runtime\nor something only a macOS 27 Mac has.",
      "oneOf": [
        {
          "description": "Fakes, mocks, dummy servers, fake providers, or contract fixtures.",
          "type": "string",
          "const": "fixture"
        },
        {
          "description": "A real provider binary, or something only a macOS 27 Mac has.",
          "type": "string",
          "const": "native"
        }
      ]
    },
    "Language": {
      "description": "The language a test is written in, or `manual` for a review.",
      "oneOf": [
        {
          "description": "A Rust `#[test]`.",
          "type": "string",
          "const": "rust"
        },
        {
          "description": "A Swift Testing `@Test`.",
          "type": "string",
          "const": "swift"
        },
        {
          "description": "A manual review.",
          "type": "string",
          "const": "manual"
        }
      ]
    },
    "Method": {
      "description": "Whether a record comes from a test run or from a reviewer.",
      "oneOf": [
        {
          "description": "Written by the Rust guard or the Swift trait during a test run.",
          "type": "string",
          "const": "automated"
        },
        {
          "description": "Written by `cargo xtask evidence new` and filled in by a reviewer.",
          "type": "string",
          "const": "manual"
        }
      ]
    },
    "RunContext": {
      "description": "What the wrapper knows about a run, computed once at its start.\n\n`cargo xtask evidence run` writes it to `run.json` and copies it into\nevery record of `report.json`; `cargo xtask evidence new` fills it for a\nmanual record. Raw record files written by a test carry none.",
      "type": "object",
      "properties": {
        "baseline": {
          "description": "How the host compares with `evidence/baseline-host.json`, or null\nwhile that file does not exist.",
          "anyOf": [
            {
              "$ref": "#/$defs/BaselineMatch"
            },
            {
              "type": "null"
            }
          ],
          "default": null
        },
        "command": {
          "description": "The argv the wrapper ran, or null for a manual record.",
          "type": [
            "array",
            "null"
          ],
          "default": null,
          "items": {
            "type": "string"
          }
        },
        "host": {
          "description": "The machine the run happened on.",
          "$ref": "#/$defs/Host"
        },
        "runId": {
          "description": "The run ID from the wrapper, or null for a manual record.",
          "type": [
            "string",
            "null"
          ],
          "format": "uuid",
          "default": null
        },
        "runKind": {
          "description": "The kind of the run, or null for a manual record.",
          "anyOf": [
            {
              "$ref": "#/$defs/Kind"
            },
            {
              "type": "null"
            }
          ],
          "default": null
        },
        "sourceCommit": {
          "description": "The commit that was tested, from `git rev-parse HEAD`.",
          "type": "string"
        },
        "sourceDirty": {
          "description": "True when `git status --porcelain --untracked-files=normal` was not\nempty at the start of the run. A dirty run is never release evidence.",
          "type": "boolean"
        },
        "toolchain": {
          "description": "Toolchain versions found on the host.",
          "$ref": "#/$defs/Toolchain"
        }
      },
      "required": [
        "sourceCommit",
        "sourceDirty",
        "host",
        "toolchain"
      ]
    },
    "Source": {
      "description": "Where a provider or runtime under test came from.",
      "oneOf": [
        {
          "description": "A runtime Stackly installs and owns.",
          "type": "string",
          "const": "managed"
        },
        {
          "description": "A runtime found on the system, such as a Homebrew one.",
          "type": "string",
          "const": "external"
        },
        {
          "description": "A fake or fixture. Never used by a native record.",
          "type": "string",
          "const": "fixture"
        }
      ]
    },
    "Status": {
      "description": "The status of a record (PRD section 28).",
      "oneOf": [
        {
          "description": "No result was observed yet. Every record starts here.",
          "type": "string",
          "const": "NOT_RUN"
        },
        {
          "description": "The test or review passed.",
          "type": "string",
          "const": "PASS"
        },
        {
          "description": "The test or review failed.",
          "type": "string",
          "const": "FAIL"
        },
        {
          "description": "A prerequisite (binary, hardware, signing) was missing.",
          "type": "string",
          "const": "BLOCKED"
        },
        {
          "description": "Manual only: the scope is outside the baseline.",
          "type": "string",
          "const": "DEFERRED"
        }
      ]
    },
    "Subject": {
      "description": "One provider or runtime a test ran against.",
      "type": "object",
      "properties": {
        "digest": {
          "description": "The SHA-256 of the artifact as 64 lowercase hex characters, or null.",
          "type": [
            "string",
            "null"
          ],
          "default": null
        },
        "provider": {
          "description": "The provider, for example `postgresql`.",
          "type": "string"
        },
        "source": {
          "description": "Where the runtime came from.",
          "$ref": "#/$defs/Source"
        },
        "version": {
          "description": "The exact version, read from the running binary.",
          "type": "string"
        }
      },
      "required": [
        "provider",
        "version",
        "source"
      ]
    },
    "TestIdentity": {
      "description": "The identity of a test: `(language, package, target, name)`, plus where\nit lives.",
      "type": "object",
      "properties": {
        "file": {
          "description": "The source file, relative to the workspace root in `report.json`.",
          "type": [
            "string",
            "null"
          ],
          "default": null
        },
        "language": {
          "description": "The language of the test.",
          "$ref": "#/$defs/Language"
        },
        "line": {
          "description": "The line of the guard or the test.",
          "type": [
            "integer",
            "null"
          ],
          "format": "uint32",
          "default": null,
          "minimum": 0
        },
        "name": {
          "description": "Rust: the libtest test path. Swift: the test ID without module and\nlocation. Manual: the title.",
          "type": "string"
        },
        "package": {
          "description": "Rust: `CARGO_PKG_NAME`. Swift and manual: null.",
          "type": [
            "string",
            "null"
          ],
          "default": null
        },
        "target": {
          "description": "Rust: `CARGO_CRATE_NAME`. Swift: the module name. Manual: null.",
          "type": [
            "string",
            "null"
          ],
          "default": null
        }
      },
      "required": [
        "language",
        "name"
      ]
    },
    "Toolchain": {
      "description": "Toolchain versions found on the host.",
      "type": "object",
      "properties": {
        "rustc": {
          "description": "The second token of `rustc --version`, for example `1.99.1`.",
          "type": [
            "string",
            "null"
          ],
          "default": null
        },
        "swift": {
          "description": "The version number from `swift --version`, for example `6.4`, or\nnull without Swift.",
          "type": [
            "string",
            "null"
          ],
          "default": null
        },
        "xcode": {
          "description": "The two lines of `xcodebuild -version` joined, for example\n`27.0 (27A266a)`, or null without Xcode.",
          "type": [
            "string",
            "null"
          ],
          "default": null
        }
      }
    }
  }
}
