{
  "schema": "stackly.evidence/v1",
  "id": "01a14e57-e0d8-75bf-bff5-2ce203340b51",
  "covers": [
    "AC-058",
    "AC-031"
  ],
  "kind": "fixture",
  "method": "manual",
  "test": {
    "language": "manual",
    "package": null,
    "target": null,
    "name": "Spec 0010 spike: posix_spawn flags, fd map, argv, env, cwd",
    "file": null,
    "line": null
  },
  "status": "PASS",
  "expected": "posix_spawn with POSIX_SPAWN_SETSID, SETSIGDEF (all signals), an empty SETSIGMASK, CLOEXEC_DEFAULT and START_SUSPENDED, fd sources duplicated to 10 and up first, addopen /dev/null on 0, adddup2 to 1, 2, 3 and addchdir_np gives a child whose argv, env, cwd, signal state and fds 0 to 3 are exactly the plan's (spec 0010 AC-1, Adapter macOS row Spawn)",
  "actual": "Suspended child read from the kernel before it ran any code: PROC_PIDLISTFDS lists exactly fds 0,1,2,3 (all vnodes) although the parent had a leaked non-CLOEXEC fd; fd 0 is /dev/null, fds 1, 2, 3 match the stdout spool, stderr spool and instance.lock by dev and inode. KERN_PROCARGS2 argv equals [canonical executable, plan args] exactly, including a label with spaces, quotes, $( ), backticks, |, &, >, *, ~, ü and 空; env is exactly the two plan entries (the parent-only variable is absent). cwd (PROC_PIDVNODEPATHINFO) is the plan cwd. kinfo_proc: p_sigmask 0 although the parent blocked SIGUSR1; p_sigignore 0x18488000, which is only the kernel's default-ignore set (SIGURG, SIGCHLD, SIGIO, SIGWINCH, SIGINFO), so SIGPIPE and SIGHUP that the parent ignored are back to default; sigfillset in setsigdefault was accepted. After SIGCONT, argv-serve.json equals the plan args byte for byte and no pwned file exists anywhere under the test root. A daemon with fds 0, 1, 2 closed (lock, stdout and stderr spool landing on 0, 1, 2) still gives the child the right fds 0..3 when sources are first duplicated to 10 and up; the naive mapping without that step gives the child only fds 0 and 3, both /dev/null. posix_spawn returns ENOENT for a missing executable, EACCES for a non-executable file, and ENOENT for a missing cwd (addchdir_np), with no child in each case. Helper path: stdin pipe written then closed, the fake init helper read to EOF, exited 0, and token.sha256 equals the SHA-256 of the bytes written; it held the lock on fd 3 while it ran. For step 3: libc 0.2.190 has no POSIX_SPAWN_SETSID (0x0400 in sys/spawn.h), so the adapter declares it.",
  "reason": null,
  "owner": null,
  "subjects": [],
  "steps": [
    "Checked out d99e5ea (clean) in worktree f10-spike-a90e60 on this Mac (macOS 27.0 build 26A428, arm64, Apple Silicon, page size 16384).",
    "cargo build -p stackly-fake-server --locked; the child in every scenario is target/debug/stackly-fake-server (or /bin/sh and /bin/sleep where a process group or a descendant is needed).",
    "Built the throwaway spike outside the workspace: spike-main.rs.txt as src/main.rs and spike-Cargo.toml.txt as Cargo.toml (libc =0.2.190, the workspace's version, plus serde_json), cargo build --offline --release. Source, full run log, and the extra experiments are in the evidence folder of the first record of this set (title 'Spec 0010 spike: posix_spawn flags, fd map, argv, env, cwd').",
    "Ran `spike0010 run target/debug/stackly-fake-server 60`. Test root under the darwin user temp folder (confstr _CS_DARWIN_USER_TEMP_DIR) at stackly-spike0010-<pid>/Test Root Ünï cödé, fake runtime copied to runtime/fake/0.1.0/aarch64-apple-darwin/0f1e2d3c/bin/stackly-fake-server and spawned by its canonical path, data and instance.lock under data/instances/<name>/, spools under run/i/<name>/. Every spawned pid was registered and killed or reaped at the end; the run's cleanup check found no leftover process, and the test root was removed.",
    "Rows checked by the [spawn] and [setup] lines of output.txt: suspended spawn of `serve` with the hostile label, inspection through PROC_PIDLISTFDS, PROC_PIDFDVNODEPATHINFO, KERN_PROCARGS2, PROC_PIDVNODEPATHINFO and kinfo_proc while suspended, then SIGCONT and the argv file; the closed-fds daemon (subcommand closed-fds) with and without the dup to 10 and up; spawn errors; and the init helper with a stdin pipe.",
    "Files in this record's folder: spike-main.rs.txt and spike-Cargo.toml.txt (the spike source), run-full.log (the `run` output every record of this set cites), seek-exp.log (`spike0010 seek-exp <dir> plain|fsync|sync-reader|align16384|align65536`), and run-fsync.log (`spike0010 load-fsync <fake> 60`). run-full.log came from the build just before the `load-fsync` subcommand and the PageFsync alignment were added; that change only adds them and renames the load test's instance folder from spool-load-<bytes> to spool-load-<alignment name>."
  ],
  "reviewer": "Claude Opus 5.5 (session f10-spike, for ojiepermana)",
  "startedAt": "2026-10-18T09:29:04.472255Z",
  "finishedAt": "2026-10-18T09:29:27Z",
  "evidencePath": "evidence/manual/files/01a14e57-e0d8-75bf-bff5-2ce203340b51/",
  "context": {
    "sourceCommit": "d99e5eaa1fc8c556adfae425ac020b4529be74f7",
    "sourceDirty": false,
    "runId": null,
    "runKind": null,
    "command": null,
    "host": {
      "os": "macos",
      "arch": "aarch64",
      "osVersion": "27.0",
      "osBuild": "26A428",
      "hardwareModel": "Mac13,1",
      "chip": "Apple M1 Max",
      "memoryBytes": 34359738368,
      "performanceCores": 8,
      "efficiencyCores": 2,
      "virtualized": false
    },
    "baseline": {
      "matches": true,
      "osBuildMatches": true
    },
    "toolchain": {
      "rustc": "1.99.1",
      "xcode": "27.0 (27A266a)",
      "swift": "6.4"
    }
  }
}
