{
  "schema": "stackly.evidence/v1",
  "id": "01a14e57-e653-7376-80d1-3fa5b0fcf2fa",
  "covers": [
    "AC-013",
    "REQ-013",
    "AC-067"
  ],
  "kind": "fixture",
  "method": "manual",
  "test": {
    "language": "manual",
    "package": null,
    "target": null,
    "name": "Spec 0010 spike: PROC_PIDTBSDINFO facts for this user's processes",
    "file": null,
    "line": null
  },
  "status": "PASS",
  "expected": "proc_pidinfo(PROC_PIDTBSDINFO) gives pid, ppid, pgid, uid, status and the start time in seconds and microseconds for this user's processes, child or not, suspended or running, and fails for gone or zombie pids (spec 0010 AC-2, AC-9, Adapter macOS row Waktu start, user, group, parent, tertahan)",
  "actual": "Suspended child: pid, ppid = spike, pgid = pid (SETSID), uid 502, start time in seconds and microseconds (for example 1792315326.054120, 0.4 s before now), unchanged after SIGCONT. Non-child (its daemon exited, ppid 1, another session): readable, start time equals the one the old daemon recorded while the child was suspended, uid matches, pgid = pid. Zombie child (exited, not reaped): PROC_PIDTBSDINFO returns ESRCH, so inspect returns None as the spec wants, while kinfo p_stat shows SZOMB and kill(pid, 0) still succeeds (the pid stays taken until reaped). Absent pid: ESRCH. struct proc_bsdinfo in libc 0.2.190 is 136 bytes, equal to the SDK. kinfo_proc start time and uid equal PROC_PIDTBSDINFO for our own process. Other users' processes are a separate record (PROC_PIDTBSDINFO on other users' processes).",
  "reason": null,
  "owner": null,
  "subjects": [],
  "steps": [
    "Checked out d99e5ea (clean) in worktree f10-spike-a90e60 on this Mac (macOS 27.0 build 26A428, arm64, Apple Silicon, page size 16384).",
    "cargo build -p stackly-fake-server --locked; the child in every scenario is target/debug/stackly-fake-server (or /bin/sh and /bin/sleep where a process group or a descendant is needed).",
    "Built the throwaway spike outside the workspace: spike-main.rs.txt as src/main.rs and spike-Cargo.toml.txt as Cargo.toml (libc =0.2.190, the workspace's version, plus serde_json), cargo build --offline --release. Source, full run log, and the extra experiments are in the evidence folder of the first record of this set (title 'Spec 0010 spike: posix_spawn flags, fd map, argv, env, cwd').",
    "Ran `spike0010 run target/debug/stackly-fake-server 60`. Test root under the darwin user temp folder (confstr _CS_DARWIN_USER_TEMP_DIR) at stackly-spike0010-<pid>/Test Root Ünï cödé, fake runtime copied to runtime/fake/0.1.0/aarch64-apple-darwin/0f1e2d3c/bin/stackly-fake-server and spawned by its canonical path, data and instance.lock under data/instances/<name>/, spools under run/i/<name>/. Every spawned pid was registered and killed or reaped at the end; the run's cleanup check found no leftover process, and the test root was removed.",
    "Rows checked by the [pidinfo] lines of output.txt for the spike's own child, the orphan left by daemon-a, a zombie child, and an absent pid; the [zombie] lines show the zombie details."
  ],
  "reviewer": "Claude Opus 5.5 (session f10-spike, for ojiepermana)",
  "startedAt": "2026-10-18T09:29:05.875086Z",
  "finishedAt": "2026-10-18T09:29:27Z",
  "evidencePath": "evidence/manual/files/01a14e57-e653-7376-80d1-3fa5b0fcf2fa/",
  "context": {
    "sourceCommit": "d99e5eaa1fc8c556adfae425ac020b4529be74f7",
    "sourceDirty": false,
    "runId": null,
    "runKind": null,
    "command": null,
    "host": {
      "os": "macos",
      "arch": "aarch64",
      "osVersion": "27.0",
      "osBuild": "26A428",
      "hardwareModel": "Mac13,1",
      "chip": "Apple M1 Max",
      "memoryBytes": 34359738368,
      "performanceCores": 8,
      "efficiencyCores": 2,
      "virtualized": false
    },
    "baseline": {
      "matches": true,
      "osBuildMatches": true
    },
    "toolchain": {
      "rustc": "1.99.1",
      "xcode": "27.0 (27A266a)",
      "swift": "6.4"
    }
  }
}
