{
  "schema": "stackly.evidence/v1",
  "id": "01a14e58-21a1-756e-8d33-c898a3ce06e5",
  "covers": [
    "AC-013",
    "REQ-013"
  ],
  "kind": "fixture",
  "method": "manual",
  "test": {
    "language": "manual",
    "package": null,
    "target": null,
    "name": "Spec 0010 spike: spool with O_RDWR reader and page-size punch",
    "file": null,
    "line": null
  },
  "status": "PASS",
  "expected": "with the reader opened O_RDWR|O_NOFOLLOW and punches aligned to the VM page size, the AC-12 load keeps spool allocation bounded far below the bytes written, SEEK_DATA gives the first unreleased byte, and every line arrives whole and in order (spec 0010 AC-12 feasibility)",
  "actual": "Page size (sysconf _SC_PAGESIZE) is 16384. 40-punch experiment: allocation stays at 4096 B and SEEK_DATA equals the released offset after every punch (0 of 40 stale); 64 KiB alignment works too. AC-12 load, fake at 2000 lines/s for 60 s (6016255 and 6016100 B written, 60129 and 60158 log lines, 0 torn or out of order): per stream at most 1052672 B allocated (about 1 MiB beyond the unreleased bytes, flat from t=15 s to t=60 s, not growing), combined at most 2105344 B; SEEK_DATA after the run equals the released offset 6012928 on both streams; resuming as a restarted daemon from SEEK_DATA and dropping to the first newline (17 B) gives a whole line. A rerun with fsync after every punch gave the same 1052672 B per stream. A no-punch control allocated at most 61440 B beyond EOF. Caveat for AC-12's number: per spool file the allocation stays near 1 MiB, but both spools together reached 2105344 B, 8 KiB over 2 MiB (2064384 B in an earlier run), so 'under 2 MiB' holds per spool, not for the two together.",
  "reason": null,
  "owner": null,
  "subjects": [],
  "steps": [
    "Checked out d99e5ea (clean) in worktree f10-spike-a90e60 on this Mac (macOS 27.0 build 26A428, arm64, Apple Silicon, page size 16384).",
    "cargo build -p stackly-fake-server --locked; the child in every scenario is target/debug/stackly-fake-server (or /bin/sh and /bin/sleep where a process group or a descendant is needed).",
    "Built the throwaway spike outside the workspace: spike-main.rs.txt as src/main.rs and spike-Cargo.toml.txt as Cargo.toml (libc =0.2.190, the workspace's version, plus serde_json), cargo build --offline --release. Source, full run log, and the extra experiments are in the evidence folder of the first record of this set (title 'Spec 0010 spike: posix_spawn flags, fd map, argv, env, cwd').",
    "Ran `spike0010 run target/debug/stackly-fake-server 60`. Test root under the darwin user temp folder (confstr _CS_DARWIN_USER_TEMP_DIR) at stackly-spike0010-<pid>/Test Root Ünï cödé, fake runtime copied to runtime/fake/0.1.0/aarch64-apple-darwin/0f1e2d3c/bin/stackly-fake-server and spawned by its canonical path, data and instance.lock under data/instances/<name>/, spools under run/i/<name>/. Every spawned pid was registered and killed or reaped at the end; the run's cleanup check found no leftover process, and the test root was removed.",
    "Rows checked by the [spool] lines of output.txt for 16384 alignment (experiment and 60 s load) and the no-punch control; run-fsync.log in the first record's folder is the 60 s load with fsync after each punch (`spike0010 load-fsync <fake> 60`)."
  ],
  "reviewer": "Claude Opus 5.5 (session f10-spike, for ojiepermana)",
  "startedAt": "2026-10-18T09:29:21.057004Z",
  "finishedAt": "2026-10-18T09:29:27Z",
  "evidencePath": "evidence/manual/files/01a14e58-21a1-756e-8d33-c898a3ce06e5/",
  "context": {
    "sourceCommit": "d99e5eaa1fc8c556adfae425ac020b4529be74f7",
    "sourceDirty": false,
    "runId": null,
    "runKind": null,
    "command": null,
    "host": {
      "os": "macos",
      "arch": "aarch64",
      "osVersion": "27.0",
      "osBuild": "26A428",
      "hardwareModel": "Mac13,1",
      "chip": "Apple M1 Max",
      "memoryBytes": 34359738368,
      "performanceCores": 8,
      "efficiencyCores": 2,
      "virtualized": false
    },
    "baseline": {
      "matches": true,
      "osBuildMatches": true
    },
    "toolchain": {
      "rustc": "1.99.1",
      "xcode": "27.0 (27A266a)",
      "swift": "6.4"
    }
  }
}
